{"$schema":"https://json-schema.org/draft/2020-12/schema","$id":"ox-genesis-batch-plan-1.schema.json","title":"OriginX Genesis Batch Plan","type":"object","additionalProperties":false,"required":["batchPlanVersion","batchId","range","tokensRequested","model","executionPolicy","tokens","batchManifestHash"],"properties":{"batchPlanVersion":{"const":"OX-GENESIS-BATCH-PLAN-1"},"batchId":{"const":"GENESIS-BATCH-0001"},"range":{"const":"#0001-#0010"},"tokensRequested":{"const":10},"model":{"type":"object"},"executionPolicy":{"type":"object"},"tokens":{"type":"array","minItems":10,"maxItems":10},"batchManifestHash":{"type":"string"}}}
