{"batchId":"GENESIS-BATCH-0001","batchManifestHash":"sha256:c3f96136bc7564f9b8debcc3437342274dfc82bc000e22e4829017da7740885a","batchPlanVersion":"OX-GENESIS-BATCH-PLAN-1","executionPolicy":{"batchSize":1,"cooldownSecondsBetweenTokens":120,"executionAllowed":false,"maximumThermalRaw":80000,"minimumMemAvailableKB":1200000,"mode":"SEQUENTIAL","nextBatchAutomatic":false,"stopOnDeviceRestart":true,"stopOnFailure":true,"thermalLimitAppliedOnlyWhenSensorAvailable":true,"timeoutSecondsPerToken":5400},"model":{"modelHash":"sha256:b8944e9fe0b69b36ae1b5bb0185b3a7b8ef14347fe0fa9af6c64c4829022261f","modelId":"OX-MODEL-002","productionAlias":"OX-GENESIS-MODEL-1","status":"CANDIDATE_PENDING_GENESIS_GATE"},"range":"#0001-#0010","tokens":[{"artSpecHash":"sha256:090e9e1cbeb995883c136833531bfca69817cb7f4b32b246e710049bed6e55ca","bindingHash":"sha256:da60c996c2aded663d9d165c838d880c40ba02341f9d47886572329a7f3d95f2","candidatePath":"output/genesis/batch-0001/token-0001/candidate/token-0001-candidate-001.png","canonical":false,"canonicalName":"Azhurak Primordialis","command":["/root/stable-diffusion.cpp/build/bin/sd-cli","--model","models/sd15/stable-diffusion-v1-5-pruned-emaonly-Q4_0.gguf","--prompt","Azhurak Primordialis, The Primordial Witness. A unique colossal primordial dragon, ancient, foundational, monumental, dark, heavy, powerful and mysterious. Body structure: colossal-grounded. Horn architecture: forward-megalithic-crown. Wing geometry: massive-ribbed-vault. Pose: grounded-apex-stance. Believable quadrupedal dragon anatomy, massive coherent wings, balanced tail, clear monumental silhouette, full body visible. Environment: basalt-origin-citadel, gothic megalithic architecture, mineral fog, controlled ash and primordial storm. Materials: obsidian, weathered-stone, weathered stone, dark forged metal, ancient proto-technology. Resonance class MONOLITHIC influences a restrained 8-spoke structural rhythm in horns, wings, cracks, engravings and architecture. Lighting: deep-crimson-forge-rim, cinematic high contrast, restrained cyan and crimson mineral accents. Extreme physically coherent material detail, erosion, fractures, scratches, mineral deposits, scale variation, detailed eyes. Original OriginX visual grammar, cinematic dark fantasy realism, square composition, macro correctness before micro detail.","--negative-prompt","generic fantasy dragon, franchise character, cartoon, anime, cute, toy, excessive neon, cyberpunk city, text, letters, logo, watermark, signature, duplicate dragon, extra heads, extra limbs, missing limbs, malformed anatomy, disconnected wings, tiny wings, broken tail, floating body, cropped body, blurry, low detail, flat lighting, plastic material, oversaturated colors","--width","512","--height","512","--steps","12","--cfg-scale","7.0","--sampling-method","euler_a","--seed","5770080363699867898","--threads","4","--params-backend","disk","--mmap","--vae-tiling","--vae-tile-size","128x128","--output","output/genesis/batch-0001/token-0001/candidate/token-0001-candidate-001.png","--verbose"],"dnaHash":"sha256:c775e62b4bdd2feee5c587f4c8cd227a7d374b7121937194a9cf902d7efafe53","glyphHash":"sha256:0a98e7baa09b6d4a3592921fbf91cb7df85cd0185537cb6dcb6b4804bd361131","negativePrompt":"generic fantasy dragon, franchise character, cartoon, anime, cute, toy, excessive neon, cyberpunk city, text, letters, logo, watermark, signature, duplicate dragon, extra heads, extra limbs, missing limbs, malformed anatomy, disconnected wings, tiny wings, broken tail, floating body, cropped body, blurry, low detail, flat lighting, plastic material, oversaturated colors","positivePrompt":"Azhurak Primordialis, The Primordial Witness. A unique colossal primordial dragon, ancient, foundational, monumental, dark, heavy, powerful and mysterious. Body structure: colossal-grounded. Horn architecture: forward-megalithic-crown. Wing geometry: massive-ribbed-vault. Pose: grounded-apex-stance. Believable quadrupedal dragon anatomy, massive coherent wings, balanced tail, clear monumental silhouette, full body visible. Environment: basalt-origin-citadel, gothic megalithic architecture, mineral fog, controlled ash and primordial storm. Materials: obsidian, weathered-stone, weathered stone, dark forged metal, ancient proto-technology. Resonance class MONOLITHIC influences a restrained 8-spoke structural rhythm in horns, wings, cracks, engravings and architecture. Lighting: deep-crimson-forge-rim, cinematic high contrast, restrained cyan and crimson mineral accents. Extreme physically coherent material detail, erosion, fractures, scratches, mineral deposits, scale variation, detailed eyes. Original OriginX visual grammar, cinematic dark fantasy realism, square composition, macro correctness before micro detail.","renderPlanHash":"sha256:1303d538826be3e9c2c7d7af50507668690181fe2f60a183792b777c67907282","resonanceSignature":"sha256:66f2c3015b51ec76657902ca5f03d6fa1a34662d874c98bb5dc4f22f71b679c6","seed":5770080363699867898,"serial":"#0001","state":"PREPARED_NOT_EXECUTED","tokenId":1},{"artSpecHash":"sha256:a5d8ac09d7a398ec9adf51e2f1a358759d3a1c9b5c3b426e4e32a000476dc899","bindingHash":"sha256:609af035366193921891a43857719e198c00a5f5a29f1688e9c368017da38219","candidatePath":"output/genesis/batch-0001/token-0002/candidate/token-0002-candidate-001.png","canonical":false,"canonicalName":"Vaeltharos Monolith","command":["/root/stable-diffusion.cpp/build/bin/sd-cli","--model","models/sd15/stable-diffusion-v1-5-pruned-emaonly-Q4_0.gguf","--prompt","Vaeltharos Monolith, Keeper of the First Monolith. A unique colossal primordial dragon, ancient, foundational, monumental, dark, heavy, powerful and mysterious. Body structure: monumental-serpentine. Horn architecture: radial-basal-arches. Wing geometry: cathedral-buttress-wing. Pose: low-crouched-storm-defiance. Believable quadrupedal dragon anatomy, massive coherent wings, balanced tail, clear monumental silhouette, full body visible. Environment: mineral-fog-megalith-field, gothic megalithic architecture, mineral fog, controlled ash and primordial storm. Materials: basalt, dark-forged-metal, weathered stone, dark forged metal, ancient proto-technology. Resonance class ABYSSAL influences a restrained 8-spoke structural rhythm in horns, wings, cracks, engravings and architecture. Lighting: subsurface-mineral-glow, cinematic high contrast, restrained cyan and crimson mineral accents. Extreme physically coherent material detail, erosion, fractures, scratches, mineral deposits, scale variation, detailed eyes. Original OriginX visual grammar, cinematic dark fantasy realism, square composition, macro correctness before micro detail.","--negative-prompt","generic fantasy dragon, franchise character, cartoon, anime, cute, toy, excessive neon, cyberpunk city, text, letters, logo, watermark, signature, duplicate dragon, extra heads, extra limbs, missing limbs, malformed anatomy, disconnected wings, tiny wings, broken tail, floating body, cropped body, blurry, low detail, flat lighting, plastic material, oversaturated colors","--width","512","--height","512","--steps","12","--cfg-scale","7.0","--sampling-method","euler_a","--seed","6546531190901250070","--threads","4","--params-backend","disk","--mmap","--vae-tiling","--vae-tile-size","128x128","--output","output/genesis/batch-0001/token-0002/candidate/token-0002-candidate-001.png","--verbose"],"dnaHash":"sha256:c42be7b46c48e0d4a98e2fb806740b55455505d7b4329cc0d85862d8995d5b3a","glyphHash":"sha256:2eab4a5dc75778e4fcb63690fb0393b793337364df8ec5f59f011e6d321a3807","negativePrompt":"generic fantasy dragon, franchise character, cartoon, anime, cute, toy, excessive neon, cyberpunk city, text, letters, logo, watermark, signature, duplicate dragon, extra heads, extra limbs, missing limbs, malformed anatomy, disconnected wings, tiny wings, broken tail, floating body, cropped body, blurry, low detail, flat lighting, plastic material, oversaturated colors","positivePrompt":"Vaeltharos Monolith, Keeper of the First Monolith. A unique colossal primordial dragon, ancient, foundational, monumental, dark, heavy, powerful and mysterious. Body structure: monumental-serpentine. Horn architecture: radial-basal-arches. Wing geometry: cathedral-buttress-wing. Pose: low-crouched-storm-defiance. Believable quadrupedal dragon anatomy, massive coherent wings, balanced tail, clear monumental silhouette, full body visible. Environment: mineral-fog-megalith-field, gothic megalithic architecture, mineral fog, controlled ash and primordial storm. Materials: basalt, dark-forged-metal, weathered stone, dark forged metal, ancient proto-technology. Resonance class ABYSSAL influences a restrained 8-spoke structural rhythm in horns, wings, cracks, engravings and architecture. Lighting: subsurface-mineral-glow, cinematic high contrast, restrained cyan and crimson mineral accents. Extreme physically coherent material detail, erosion, fractures, scratches, mineral deposits, scale variation, detailed eyes. Original OriginX visual grammar, cinematic dark fantasy realism, square composition, macro correctness before micro detail.","renderPlanHash":"sha256:2340becee821d4e1a9f9e97f6899581a4b547cb2a9d06c92661650a3c923fe84","resonanceSignature":"sha256:df7507485e86fe7b76a9a47b396237677e03c7700c3f197176e19737bd9705fb","seed":6546531190901250070,"serial":"#0002","state":"PREPARED_NOT_EXECUTED","tokenId":2},{"artSpecHash":"sha256:3b5b1748ef706ead53490eedbdfb45a6f0cc0048269ca223c1a71217fded3177","bindingHash":"sha256:459b2aadf8c2799d1d0302d4be6d07e24e9951db8754f6e7bd5b4af787f9d016","candidatePath":"output/genesis/batch-0001/token-0003/candidate/token-0003-candidate-001.png","canonical":false,"canonicalName":"Korvaxion the First Ember","command":["/root/stable-diffusion.cpp/build/bin/sd-cli","--model","models/sd15/stable-diffusion-v1-5-pruned-emaonly-Q4_0.gguf","--prompt","Korvaxion the First Ember, Bearer of the Foundation Flame. A unique colossal primordial dragon, ancient, foundational, monumental, dark, heavy, powerful